id,name,description,gender,age,address,race,image
1,Isabella,Her thoughts are impenetrable No one can read her mind unless she lets them She is able to defend against all types of psychological attacks and has learned to protect those around her from such attacks,Female,17,Forks Washington,The vampire
2,Edward,He could read the mind of anyone who came near him but Bella Cullen was an exception,Male,17,Chicago Illinois,The vampire
3,Jacob Black,Alpha breed of wolves super fast,Male,20,Chicago Illinois,A werewolf
4,Alice Cullen,Seeing things that might happen and things that might happen,Female,16,Chicago Illinois,The vampire
5,Victoria,Special anti-tracking and escape ability,Female,1700,Chicago Illinois,The vampire
6,Aro,The head of the Volturi family Learn all the thoughts of others by the touch of their hands except Bella,Male,3000,Chicago Illinois,The vampire